quelle,episode,index_string,index_binar
mess_46,er legte sein schwert ab trat ein und kaempfte lange zeit erbittert mit der lamia er schaffte es aber nicht sie zu besiegen so wurde auch er einer ihrer gefangenen in dem augenblick in dem der junge mann gefangen genommen wurde fiel zu hause das zeichen von der ablage als das seine mutter sah begann sie zu weinen und alle glaubten dass er verloren gegangen waere,0,0
mess_46,da begab sich sein bruder auf den weg um nach ihm zu suchen zufaellig kam auch er an der alten frau vorbei die seinen bruder bewirtet hatte sie dachte dass es sich um seinen bruder handelte der die lamia umgebracht hatte und dankte ihm,0,0
mess_46,von dort begab sich der zwillingsbruder zum palast des koenigs als ihn die frau seines bruders sah hielt sie ihn fuer ihren mann am morgen ging er hinaus und tat so als wuerde er auf jagd gehen zufaellig schlug er denselben weg ein der zur burg fuehrte als er nach seinem bruder suchte stand er mit einem mal vor der grossen burg in der die lamia wohnte,0,0
mess_46,er klopfte an die pforte und auch er hoerte eine kraeftige stimme,0,0
mess_46, wenn du waffen hast leg sie ab und komm herein,0,0
mess_46,der junge mann aber trat ein ohne sein schwert draussen zu lassen er zog sein schwert brachte die lamia um und befreite seinen bruder und alle anderen,0,0
mess_46,sie kehrten in den palast zurueck auch ihre eltern kamen dorthin und sie lebten alle zusammen gut und wir leben noch besser,0,0
mess_48,drei desertierte soldaten gingen in eine wildnis hinein in dieser wildnis stand ein schloss die fallbruecke war aber aufgezogen als sie so beim schlosse stehen blieben und es betrachteten gab sich die fallbruecke herunter sie gingen darueber und in das schloss hinein und gelangten in die stube hunger und durst hatten sie auch darum zogen sie den tischkasten auf es lag aber nur ein kartenspiel darinnen und darauf stand geschrieben nikloes da sagten sie zu einander fuer unsern hunger und durst wollen wir einmal karten als sie anfingen zu karten kam so ein altes maennlein hinein und frug was ihr begehren sei sie antworteten ihm sie haetten hunger und durst und weil sonst nichts da sei so wollten sie karten da sagte das maennlein essen koenne er ihnen keines geben aber geld koennten sie haben so viel sie wollten er fuehrte sie darauf in die silbergrube sie steckten ein soviel sie konnten dann fuehrte er sie in die goldgrube da warfen sie das silber weg und steckten dafuer gold ein zuletzt fuehrte er sie zu den edelsteinen nun warfen sie das gold weg und packten edelsteine ein als sie fertig waren sprach das alte maennlein jetzt habt ihr soviel als eine ganze stadt waehrschaft hat kommt aber nicht mehr,0,0
mess_48,die soldaten gingen nun wieder gegen ihre heimat zu und hielten alle tage ball es ging aber ihr geld doch zu ende da hielten sie rat und beschlossen wieder zum schlosse zu gehen und fuehrten den entschluss auch richtig aus als sie hinkamen war die fallbruecke wieder hinaufgezogen nachdem sie ein wenig dagestanden waren ging der verschlag die fallbruecke herunter sie gingen hinein zogen den tischkasten auf und taten die karten heraus als sie diese heraus getan hatten kam das alte maennlein wieder und sagte hab ich es euch nicht gesagt dass ihr nimmer kommen sollt jetzt muss einer da bleiben die drei soldaten losten untereinander und der den das los traf blieb da die anderen steckten soviel edelsteine ein als sie konnten und gingen auf die heimat zu zu dem der dableiben musste sagte das maennlein jetzt muesse er jahr und tag am falltor schildwache stehen die zeit vergehe ihm aber schnell sobald es ihn hungere sei sie herum das war richtig so als ihm der hunger kam war die zeit herum und er ging ins schloss zurueck das maennlein wies ihm ein zimmer an und sagte in dem zimmer muesste er drei naechte liegen dabei sah der soldat unter der bodenstiege drei schwaene sitzen das maennlein sagte noch in der ersten nacht die er in dem zimmer zubringe kaemen maenner die fragen wuerden wie viel schlaege er haben wolle und da solle er sagen einen schlag sie wuerden ihm wohl mehr anbieten er aber solle nicht mehr sagen als einen schlag nachts um 11 uhr kamen sie auch und frugen wie viele schlaege er haben wolle da sagte er einen schlag sie sprachen er muesste mehr annehmen er aber blieb dabei nicht mehr als einen schlag nehmen zu wollen um 12 uhr verliessen ihn die maenner als er frueh herunterkam waren die schwaene schwane unter der bodenstiege schon etwas schoener vor der zweiten nacht sagte das maennlein heute antwortest du zwei schlaege um 11 uhr nachts kamen sie wieder und fragten wie viele schlaege er haben wolle er antwortete zwei schlaege sie boten ihm zwar mehr an er aber blieb auf seiner aussage stehen um 12 uhr gingen sie wieder fort frueh als er herabkam waren die drei schwaene wieder schoener jetzt sagte das maennlein zu ihm heut ist die letzte nacht heute sagst du drei schlaege aber nur fest darauf geblieben sie werden dann messer heraus tuen und sie wetzen als wenn sie dich umbringen wollten um 11 uhr kamen sie wieder miteinander und fragten wieviel schlaege er wolle er sprach drei schlaege sie aber sagten er muesse mehr haben sie taten ihre messer heraus und machten sie scharf aber um 12 uhr nachts gingen sie fort frueh als er erwachte war das zimmer an den waenden golden er blieb noch etwas liegen und betrachtete das veraenderte zimmer,0,0
mess_48,die drei schwaene unter der stiege aber waren drei verwuenschte koenigstoechter sie kamen jetzt weil sie erloest waren in sein zimmer und sagten zum soldaten er solle nun aufstehen als er aufgestanden war sprachen sie zu ihm er haette jetzt die wahl unter ihnen drei er nahm die vom goldenen berg diese sagte wir sind immer als noch nicht fertig wir muessen in drei naechten zwischen 11 und 12 uhr in jene kirche gehen,0,0
mess_48,auf dem wege zu dieser kirche stand ein wirtshaus da hinein ging der soldat und logierte sich ein auf die nacht verlangte er zu trinken da sagte die wirtin das wasser in dem brunnen sei nicht gesund sie wolle ihm zitronenwasser geben sie aber gab ihm einen schlaftrunk er ging zwar hinaus setzte sich an den weg schlief aber ein um 11 uhr kam die koenigstochter gefahren mit vier rappen und die chaise war schwarz behangen,0,0
mess_48,am zweiten tag ging der soldat wieder in das wirtshaus die wirtin machte es ihm gerade so wie das erstemal und gab ihm schlaftrunk er setzte sich darauf an die strasse und schlief wieder ein um 11 uhr kam die koenigstochter gefahren die chaise war mit vier fuchsen bespannt und rot behangen der soldat sah und hoerte aber nichts am dritten abend dachte er heute nacht komme ich doch mit er nahm den knecht mit hinaus dass dieser ihn wecke wenn er wieder schlafe die wirtin hatte ihn nocheinmal betrogen als die prinzessin angefahren kam hingen vier schimmeln an der chaise und diese war weiss behangen er aber sass dort und schlief sie stieg aus wollte ihn wach bringen ebenso der knecht doch sie konnten ihn nicht aufwecken als die prinzessin von der kirche zurueckkam stieg sie wieder aus und gab sich nocheinmal die muehe ihn aufzuwecken doch alles war vergeblich sie zog nun seinen saebel aus der scheide und schrieb mit goldenen buchstaben darauf hier hast du meinen goldenen ring zum andenken dann fuhr sie fort frueh morgens rief der soldat den knecht und fragte wo sein goldener ring sei der knecht musste den goldenen 9 ring hergeben worauf der soldat ihm den kopf abhieb dann rief er der wirtin sagte zu ihr sie sei eine hexe und habe gemacht dass er nicht mit der koenigstochter in die kirche gekommen sei der soldat nahm jetzt seinen saebel wieder und hieb der wirtin auch den kopf ab dann rief er die magd zu dieser sagte er sie solle das anwesen haben darauf machte er sich auf und ging fort,0,0
mess_48,der soldat hatte noch drei brueder als er zum ersten kam sagte er zu ihm gruess gott bruder lebst du noch der antwortete ja darauf fragte der soldat ob er nicht wuesste wo der goldene berg sei der bruder antwortete wo der goldene berg sei wuesste er nicht er koenne aber die voegel zitieren wenn die es nicht wuessten er wuesste es nicht jetzt zitierte er die voegel miteinander aber keiner wusste etwas von dem goldenen berg da nahm er den staerksten vogel davon setzte den soldaten darauf und befahl dem vogel ihn so weit zu tragen als er koenne und ihn dann abzusetzen dann reiste der soldat weiter und kam zu seinem zweiten bruder er sagte zu ihm gruess gott bruder lebst du noch der antwortete ja er fragte ihn nun ob er nicht wuesste wo der goldene berg sei der antwortete nein aber das wildbret wilpert koenne er miteinander zitieren wenn das es nicht wuesste er wuesste es nicht jetzt zitierte der bruder das wildbret aber keines wusste etwas vom goldenen berg da nahm er das staerkste getier davon und setzte den soldaten darauf das musste diesen wieder so weit tragen als es konnte hierauf reiste der soldat weiter und kam zu seinem dritten bruder den gruesste er auch wie die andern zwei dann fragte dieser ihn wo er herkomme der soldat legte ihm aus wie es ihm seither erging dann fragte er seinen bruder auch ob er nicht wisse wo der goldene berg sei dieser sagte er wuesste nichts vom goldenen berg aber die wolken koenne er zitieren wenn die es nicht wuessten so sei er angefuehrt jetzt zitierte sein bruder die wolken es kam immer eine um die andere und keine wusste etwas vom goldenen berg hintennach kam noch so ein schwarzes poepela woelkchen sein bruder fragte es ob es nichts vom goldenen berg wuesste das antwortete ja es wuesste wo der goldene berg sei und morgen haette die koenigstochter hochzeit da sagte des soldaten bruder es solle den soldaten aufpacken und solle mit ihm fort so schnell es koenne damit es noch vor der hochzeit ankaeme und es kam auch richtig vor der hochzeit mit dem soldaten hin dieser ging gleich vor die residenz und liess drinnen sagen die koenigstochter solle einmal herausgehen als sie kam zeigte er ihr den saebel mit den goldenen buchstaben und den goldenen ring der andere braeutigam musste darauf fort und der soldat bekam die koenigstochter zur frau,0,0
mess_49,es war einmal ein vater der hatte drei soehne joerg michel und hans der joerg und michel waren tuechtige fleissige und vigilante 14 flinke ruehrige kerl aber mit dem hans hatte der vater sein kreuz und quaestion zu allen arbeiten stellte er sich ungeschickt und es war gar nichts rechtes mit ihm anzufangen den ganzen tag strabanzte er herum gaukelte alleweil mit hunden und katzen denen er allerlei kunststuecke lernte oder er guckte den himmel an wobei er sich gern auf den buckel legte deswegen wurde er auch nur der himmelsgucker geheissen der vater waere froh gewesen wenn er den hans vom brote gehabt haette aber kein mensch wollte ihn in den dienst nehmen eines tages musste hans in den wald hinaus um holz zu lesen da kam ein mann zu ihm und fragte ihn nach seinem aus und an verhaeltnissen hans erzaehlte treuherzig wie es mit ihm stehe dass man ihn nur den dummen hans und den himmelsgucker heisse einen solchen kerl kann ich brauchen sagte der mann zu sich den ding ich mir der mann ging mit hans heim und sprach mit seinem vater der alte war froh den hans los zu werden und so war er bald mit dem fremden mann ueberein gekommen und handeleins hans musste nun seinen buendel zusammenpacken und dahin ging er mit dem fremden mann es tat ihm gar nicht leid da er daheim nur gezankt worden war und auch oft hiebe kriegt hatte lange waren hans und der fremde mann gegangen und hans war schon ganz kaput da kamen sie an einen wald hier wollte sich hans niedersetzen gehts nicht noch e bissle sagte sein herr zu hans wir kommen bald zu einem wirtshause dort essen und trinken wir und bleiben auch uebernacht hans schleppte sich fort und war herzlich froh als sie an das wirtshaus kamen,0,0
mess_49,als sie in die wirtsstube kamen sassen schon verschiedene leute drin und als die wirtin kam waere hans bald omicht ohnmaechtig geworden so toll sah sie aus das ist eine hexe dachte hans bei sich sein herr tat aber sehr gemeinschaeftlich mit der wirtin die kennen einander gut dachte sich hans no bas kann mir dro gelich nun was kann mir dran liegen er ass und trank was heilges zeug heisst denn so gut hatte er in seinem leben noch nie gegessen und getrunken bald darauf musste er sich niederlegen was ihm ganz recht war in einem so schoenen und weichen bett hatte hans auch in seinem leben nie geschlafen er war also recht zufrieden und dachte es ist doch schoener als bei dir daheim frueh beizeit kam sein herr und weckte ihn auf allo hans raus sprach er jetzt gehts weiter hans riebelte sich die augen aus stand auf und tat zog sich an und als sie gefruehstueckt hatten ging es weiter lange liefen sie im wald fort und hans kannte sie gar nicht mehr aus endlich kamen sie an ein haeuslein so jetzt sind wir daheim das ist mein haus sprach der herr zu hans dann schloss er die tuer auf und ging mit hans ins haeuslein hinein bei mir hast du es gut sprach der herr zu hans essen und trinken darfst du was dir schmeckt und die arbeit ist auch nicht schwer du musst die katz fuettern aber lasse sie ja keinen hunger leiden holz musst du im wald suchen und es klein machen und wenn ich fort bin musst du dir halt selber kochen wenn ich daheim bin koche ich dazu musst 15 du mir bloss holz und wasser beitragen die erdaepfel schaelen und feuer anmachen hans tat alles was ihm sein herr hiess und der herr war zufrieden mit hans eines tages sprach der herr zu hans hoere hans ich gehe fort und du musst allein daheim bleiben schliesse abends immer gut zu und lass keinen menschen ins haus kochen kannst du dir was du willst zeug ist da dazu hans versprach alles richtig zu tun dann ging der herr fort ich werde lange ausbleiben sagte er noch zu hans die erste zeit krabbelte hans so im haus herum aber allmaehlich wurde ihm doch die zeit lang als er nun wieder einmal so alles im hause herumstuerte fand er in einem laedle truehlein buecher gott sei dank sagte hans jetzt hab ich doch aebbes zum lesen hans fing an in den buechern zu lesen aber da ging es ihm nicht zum besten vieles verstand er nicht und dann waren so viel haken und schnoerkel drinnen welche er auch nicht kannte dem hans ging ein licht auf sein herr war ein hexenmeister ein zauberer sobald nun hans allemal seine arbeit getan hatte setzte er sich ueber die buecher simulierte und gruebelte drin rum ueber dem gruebeln verging dem hans die zeit und er wurde es so gar nicht weiss dass er allein war nach einem halben jahre konnte hans die ganzen buecher auswendig und konnte auch das hexen perfekt eines tages ging er ein stueck in den wald hinein um holz zu lesen und als er wieder heimkehrte wunderte er sich dass die tuer auf war er wusste doch dass er zugeschlossen hatte als er in die stube kam stand sein herr darin hatte ein buch in der hand und bitzelte vor zorn du schlingel sprach er du hast in meinen buechern gelesen ich habe es daran gesehen wahrscheinlich hast du auch das hexen gelernt hans spannte dass die geschichte dreckig werden koennte und schlitzte aus er dachte das ausreissen hat kein dummer erdacht aber hier nuetzte es nichts denn hans war noch nicht vor die tuer gekommen so war der hexenmeister hinter ihm hans besann sich nicht lange machte sich zu einem adler und flog auf und davon der hexenmeister ging in die stube holte ein gewehr und schoss auf hans aber hans hatte sich kugelsicher gemacht die kugel tat ihm nichts und er flog ruhig weiter der hexenmeister sprach der kanns besse bi wie ich den muss ich mit list dro krieg gewalt hilft da nichts,0,0
mess_49,als hans ueber den wald hinaus geflogen war guckte er sich um und als er nichts verdaechtiges mehr sah flog er auf die erde und machte sich wieder zu einem menschen als er so dahinging war ihm doch nicht recht wohl denn er dachte sich dass ihn der hexenmeister auf schritt und tritt verfolgen werde auf einmal sah er ueber sich einen geier fliegen und hans erkannte seinen herrn hans machte sich zu einem gaul und fing an und jackte galoppierte was er konnte waehrend er so dahinjackte sah er einen bauern gehen auf diesen hielt er zu und da der bauer dachte es sei ein durchgegangener gaul so fing er ihn was sich hans ruhig gefallen liess als der bauer so mit hans dahin ging kam ein nobler herr zu ihnen der wollte den gaul kaufen dem 16 hans wurde angst und bang er kannte den nobeln herrn es war der hexenmeister hans sagte leis zum bauern verkaufe mich nicht darueber waere der bauer bald omich worn ein gaul der reden konnte war ihm was neues der bauer verkaufte den gaul nun erst recht nicht denn einen gaul der reden konnte hatte nicht jeder mensch er fuehrte also den hans heim in seinen stall im stalle litt es hans nicht lange er machte sich zu einer fliege und flog durch einen fensterritz davon wie er so dahin flog sah er unter sich den hexenmeister gehen aber auch dieser hatte den hans bald bemerkt er machte sich zu einer schwalbe und flog dem hans nach bald haette er den hans erschnappt aber hans machte sich zu einem fingerle fingerringlein und fiel vor einem maedchen nieder das gerade daher ging das maedchen sah das fingerle hob es auf und steckte es an seinen finger wohin es recht schoen passte alle tage kam nun ein mann der dem maedchen das ringlein abkaufen wollte doch das maedchen gab es nicht her eines tages als der mann wieder lange umsonst gehandelt hatte wollte er dem maedchen das ringlein mit gewalt nehmen da fiel das ringlein auf den boden und wurde zu lauter hirsekoernern der fremde mann es war der hexenmeister machte sich zu einem goehger hahn und frass die hirsekoerner auf dann flog er davon die sache hatte aber doch einen haken gehabt der hexenmeister glaubte er haette den hans vertilgt aber der hans lebte noch ein hirsekoernlein welches der hans selbst war hatte der hexenmeister uebersehen dies hirsekoernlein war in des maedchens pantoffel gefallen und dort hatte es der hexenmeister nicht gesehen hans verwandelte sich wieder in seine richtige gestalt und freite um das maedchen das ihn schon als ring an der hand getragen hatte das maedchen fand gefallen an hans und wurde seine frau,0,0
mess_49,sie lebten sehr lange und waren gluecklich miteinander aber nie soll hans seiner frau etwas von seiner hexenkunst erzaehlt haben und ihr auch nie gesagt haben dass sie ihn schon als ring an der hand getragen habe gegen seine frau war hans sehr gut da er sich immer dachte hat sie mich als ring schon so gern gehabt so hat sie mich als mensch noch viel lieber,0,0
mess_49,seine hexenkunst hat hans nie mehr ausgeuebt da er bei seinem ersten versuch so viel angst hat ausstehen muessen und wenn einmal die rede aufs hexen kam soll hans immer gesagt haben das ist nichts fuer rechtschaffene leute,0,0
mess_50,ein vater hatte zwei soehne davon war der aelteste klug und gescheit und wusste sich in alles wohl zu schicken der juengste aber war dumm konnte nichts begreifen und lernen und wenn ihn die leute sahen sprachen sie mit dem wird der vater noch seine last haben wenn nun etwas zu tun war so musste es der aelteste allzeit ausrichten hiess ihn aber der vater noch spaet oder gar in der nacht etwas holen und der weg ging dabei ueber den kirchhof oder sonst einen schaurigen ort so antwortete er wohl ach nein vater ich gehe nicht dahin es gruselt mir denn er fuerchtete sich oder wenn abends beim feuer geschichten erzaehlt wurden wobei einem die haut schaudert so sprachen die zuhoerer manchmal ach es gruselt mir der juengste sass in einer ecke und hoerte das mit an und konnte nicht begreifen was es heissen sollte immer sagen sie es gruselt mir es gruselt mir mir gruselts nicht das wird wohl eine kunst sein von der ich auch nichts verstehe,0,0
mess_50,nun geschah es dass der vater einmal zu ihm sprach hoer du in der ecke dort du wirst gross und stark du musst auch etwas lernen womit du dein brot verdienst siehst du wie dein bruder sich muehe gibt aber an dir ist hopfen und malz verloren ei vater antwortete er ich will gerne was lernen ja wenns anginge so moechte ich lernen dass mirs gruselte davon verstehe ich noch gar nichts der aelteste lachte als er das hoerte und dachte bei sich du lieber gott was ist mein bruder ein dummbart aus dem wird sein lebtag nichts was ein haekchen werden will muss sich beizeiten kruemmen der vater seufzte und antwortete ihm das gruseln das sollst du schon lernen aber dein brot wirst du damit nicht verdienen,0,0
mess_50,bald danach kam der kuester zum besuch ins haus da klagte ihm der vater seine not und erzaehlte wie sein juengster sohn in allen dingen so schlecht beschlagen waere er wuesste nichts und lernte nichts denkt euch als ich ihn fragte womit er sein brot verdienen wollte hat er gar verlangt das gruseln zu lernen wenns weiter nichts ist antwortete der kuester das 51 kann er bei mir lernen tut ihn nur zu mir ich werde ihn schon abhobeln der vater war es zufrieden weil er dachte der junge wird doch ein wenig zugestutzt der kuester nahm ihn also ins haus und er musste die glocke laeuten nach ein paar tagen weckte er ihn um mitternacht hiess ihn aufstehen in den kirchturm steigen und laeuten du sollst schon lernen was gruseln ist dachte er ging heimlich voraus und als der junge oben war und sich umdrehte und das glockenseil fassen wollte so sah er auf der treppe dem schalloch gegenueber eine weisse gestalt stehen wer da rief er aber die gestalt gab keine antwort regte und bewegte sich nicht gib antwort rief der junge oder mache dass du fortkommst du hast hier in der nacht nichts zu schaffen der kuester aber blieb unbeweglich stehen damit der junge glauben sollte es waere ein gespenst der junge rief zum zweitenmal was willst du hier sprich wenn du ein ehrlicher kerl bist oder ich werfe dich die treppe hinab der kuester dachte das wird so schlimm nicht gemeint sein gab keinen laut von sich und stand als wenn er von stein waere da rief ihn der junge zum drittenmal an und als das auch vergeblich war nahm er einen anlauf und stiess das gespenst die treppe hinab dass es zehn stufen hinabfiel und in einer ecke liegen blieb darauf laeutete er die glocke ging heim legte sich ohne ein wort zu sagen ins bett und schlief fort die kuesterfrau wartete lange zeit auf ihren mann aber er wollte nicht wiederkommen da ward ihr endlich angst sie weckte den jungen und fragte weisst du nicht wo mein mann geblieben ist er ist vor dir auf den turm gestiegen nein antwortete der junge aber da hat einer dem schalloch gegenueber auf der treppe gestanden und weil er keine antwort geben und auch nicht weggehen wollte so habe ich ihn fuer einen spitzbuben gehalten und hinuntergestossen geht nur hin so werdet ihr sehen ob ers gewesen ist es sollte mir leid tun die frau sprang fort und fand ihren mann der in einer ecke lag und jammerte und ein bein gebrochen hatte,0,0
mess_50,sie trug ihn herab und eilte dann mit lautem geschrei zu dem vater des jungen euer junge rief sie hat ein grosses unglueck angerichtet meinen mann hat er die treppe hinabgeworfen dass er ein bein gebrochen hat schafft den taugenichts 52 aus unserm haus der vater erschrak kam herbeigelaufen und schalt den jungen aus was sind das fuer gottlose streiche die muss dir der boese eingegeben haben vater antwortete er hoert nur an ich bin ganz unschuldig er stand da in der nacht wie einer der boeses im sinne hat ich wusste nicht wers war und hab ihn dreimal ermahnt zu reden oder wegzugehen ach sprach der vater mit dir erleb ich nur unglueck geh mir aus den augen ich will dich nicht mehr ansehen ja vater recht gerne wartet nur bis tag ist da will ich ausgehen und das gruseln lernen so versteh ich doch eine kunst die mich ernaehren kann lerne was du willst sprach der vater mir ist alles einerlei da hast du fuenfzig taler damit geh in die weite welt und sage keinem menschen wo du her bist und wer dein vater ist denn ich muss mich deiner schaemen ja vater wie ihrs haben wollt wenn ihr nicht mehr verlangt das kann ich leicht in acht behalten,0,0
