quelle,episode,index_string,index_binar
0_e300c,kneten frass wasser gruetze dannen kurz frug abendessen demjenigen naehe retten darum dunkelwelt geselle toeten wirtshaus halten versuchen rede ass gefallen betruebt mensch seid einzige seien maedchen hurtigundgeschwind jedesmal gesellen verhaengt boeser krone brief drach geraubt nacheinander ueberzogen uhr fragt finde kind erste witwe fahnen geben bedeuten wirth meermanne geopfert fresse ausgeliefert muessen gleichen herberge gast uebrigen dach frassen muessten antwortete behangen bedingung haeuser toechtern unsres grossmutters jungfrau schoene geb reich damals drache alljaehrlich loos tochter wirt verschlang haeuschen schwarz koenigreichs grade flor naechste erloesen ach sei uebergeben schuster menschen befreien trauer fragte versprochen schwarzem traurig stadt warum reihe,0,0
0_e300e,drach ohnehin getroffen koenne busch hing geriet fuerchterlichen kraft konnte trug abseits thiere schnaubte wohin morgen hoerte unglueck genommen stuerzen toeteten dritten uebte strand fortzugehen stellt sass weinend rissen hauste ungeheuer spie fuerchte kaempfen stieg lamia drachenberg kruege schon zukommen meermann hinzu gesicht beten sobald sank traene fass bruecke herauskam stellte feuer schlug sechs fuehren kuechenjunge wecken wenig hieb schweif angefahren pfeil entgegen weit knie ans sah luft meer feld staeblein wartete teufel bube zweiten kapelle ungetuem los bursch haeupter verschlungen befreite bestie sprang schaden adler wagen kam dukaten lindwurm tot saebel grossem gewartet drachen hoehle schoss koepfe drache,0,0
0_e300g,versah zahl zusammen schafen aufdruecken handflaeche zusammenrufen eraber ueberlegen angeboten joerg hause jung wirthshaus ring gelangen schlief jahr danken buendel namen kueche worte retter dannen komme seidenes versprich prinzessinnen erst zuerst fahren schlaf botschaft betruebt darauf traurigen vorhin andenken nieder wandt festbinden kopfe minute kommen drachenkoepfen weiterzuschlafen kampfe strande niedersank flocht wurme mitnehmen halt verkuendete umkehren wickelt daliegenden klaftern gekaempft errettet hingefallen letzte legte tuechlein erloest wickelte eilte khantochter geschuettet heruntergeschoren ohnmachtdann boden tuch kaeme eingesteckt herausgeschnitten zungenspitzen fraeulein taschentuchs erkenne golden schneidet sieben fort muede steckte koepfen setz schnitt heraus tasche kutsche todtmuede ruhte zunge gefaess eilig zungen,0,0
0_e300o,tun lehrt froehlichkeit beweis gerollt werth raethen herumgeschleppt eingefallen bestraft wirklichen laemmerzungen frug kleider wahrheit dachten womit verneigte aufgestellt gethan wahr auseinander lebte hinaufsteigen falschen zar geschaut geschenke kaiser zeigte verdient taschentuch freudig bleibe fischersohn begruesste haetten getreulich hoerte feierten wenigen knechte betrueger moecht erzaehlte koenige getoetet sanae±n nachzusehen haengten zungenbuendel dazwischen linsen drachenhaus fuellte gestohlen weggelegt ueberaus tuecher tapfern festlichkeit tisch nein fuer beweisen drachenkoepfe naegeln gluecklich wurden geworfen laesst zurueck geschorene habensie schenkte solange geheiratet liess dorthin hofmeister sahen wirklicher hans erkannte umarmt gezogen fuenf zaehne soldaten erloeser einzigen unaussprechlicher ausgerufen pomp braeutigam drauf wahrzeichen fuhr koenig,0,0
0_e303c,jahre acht bruedern koennen schnallten stech ewig klinge petja gingen scheideweg spaeter nimmt legten schwimmen gruenes aeltere einzeln verrostet kamen aehnlich hund westen osten weiss vierzehn seite dolche todt persoenlichkeit doppelritter zaertlich durchziehen gehen zogen fischersohn wald bekommen monat probeschuss zwillingsbrueder andre dicht hinaus wollten soehne stand einander zieht rot fliesst linde beschlossen pflegevater trennten gegenseitig pferde hirschfaenger beide muetter fischmeister beiden rechts pistole zeichen messer drum versucht sehn geworden herkommt links pferd heimgekehrt weite einschnitt gen aeltern knaben abreisen wurfspeer nahmen baum umherwandern nachsehen rostflecke buechse graete umarmten abschied kinder klingen blanken trennen dienen tanne ritten welt erwachsen,0,0
mess_43,es war einmal ein koenigssohn der ritt mit seinen dienern auf die jagd er hatte schon den ganzen tag gejagt ohne etwas zu treffen er war im begriffe heimzukehren als eine ricke ihm aufstiess um doch wenigstens etwas nach hause zu bringen setzte er ihr nach aber immer wenn er sie nahe genug glaubte um seinen speer werfen zu koennen war sie ihm wieder entschwunden dabei verlor er seine gefaehrten ganz die denn ohne ihn heimkehrten die ricke lief endlich ueber eine bruecke der koenigssohn hinter ihr her kaum war er hinueber als die bruecke hinter ihm abbrach und vor ihm stand statt der ricke ein altes haessliches weib das ihn aufforderte zu folgen er musste ihr gehorchen er mochte wollen oder nicht sie fuehrte ihn in ein schloss mitten im walde das sie mit ihren drei toechtern bewohnte die beiden aeltesten waren so haesslich wie ihre mutter und ebenso unfreundlich gegen ihn die juengste aber huebsch und freundlich nach einiger zeit forderte die alte ihn auf 477 ihre aelteste tochter zu heiraten dagegen weigerte er sich aber und erbot sich die juengste zu nehmen das wollte jedoch die alte nicht und er wurde von ihr und den beiden aelteren schwestern scharf bewacht damit er nicht entrinne er fand aber doch gelegenheit der juengsten seine liebe zu gestehen die sie ihrerseits herzlich erwiderte beide beschlossen zu entfliehen im herbste liefen sie eines nachts davon aber am morgen setzte ihnen die mittlere schwester nach wie die juengste bemerkte dass sie verfolgt wurden verwandelte sie sich in einen rosenstock und ihren geliebten in eine rose da kehrte die schwester um und erzaehlte sie habe die fluechtlinge nicht finden koennen und zugleich dass sie mitten im walde einen rosenstock gesehen haette da wurde sie von ihrer mutter und schwester gescholten dass sie den rosenstock nicht mitgebracht hatte nun wurde die aelteste tochter nachgeschickt als sie den verfolgten auf die spur kam verwandelte ihre schwester sich in ein caroussel und ihren geliebten in den besitzer desselben der in der mitte sitzend in einem buche las da kehrte die aelteste um und berichtete dass sie nichts gefunden und was sie im walde gesehen nun eilte die alte ihnen selbst nach diesmal verwandelte sich die juengste tochter in einen see und den koenigssohn in eine ente die auf dem see schwamm vorher aber hatte sie ihn gewarnt dem ufer nicht zu nahe zu kommen die alte lockte die ente mit brot und einmal glaubte sie sie so nahe dass sie mit der hand darnach griff da verlor sie aber das gleichgewicht und fiel ins wasser und ertrank,0,0
mess_43,die beiden liebenden setzten nun ihren weg fort und kamen auch gluecklich in die heimat des koenigssohns vor dem thore verabredeten sie die braut solle noch draussen bleiben waehrend er hineingehe er traf nur seine mutter noch am leben sein vater war gestorben grosser jubel empfing ihn bei seiner rueckkehr und grosse feste wurden veranstaltet so dass er seine braut ganz vergass und ihm zuletzt sein ganzes erlebniss im walde wie ein traum erschien die braut wartete draussen bis an den verabredeten tag als er da nicht kam verkleidete sie sich und ging ins schloss wo sie sich als kammerzofe verdingte und durch ihre geschicklichkeit und bescheidenheit sich bald die gunst der koenigin erwarb es gelang ihr aber nicht ihren geliebten zu gesicht zu bekommen da wuenschte 478 sie sich eines tages ein prachtvolles kleid auf dem der ganze sternenhimmel zu sehen war und weil sie eine zauberin war bekam sie es auch das zeigte sie der koenigin und diese ganz entzueckt darueber wollte es ihr abkaufen das maedchen aber wollte es fuer geld nicht hergeben sondern es ihr schenken unter der bedingung dass sie eine nacht im schlafgemache des koenigs zubringen duerfe das gewaehrte die koenigin sie gab aber ihrem sohne vorher einen schlaftrunk damit er von der gegenwart der zofe nichts bemerke das maedchen suchte ihn durch weinen und wimmern zuletzt durch schuetteln und ruetteln zu erwecken es gelang ihr aber nicht sondern er schlief bis zum vollen tage wo sie das zimmer wieder verlassen musste da wuenschte sie sich ein prachtvolles tuch mit gold und perlen besetzt dass es wie die sonne leuchtete das zeigte sie wieder der koenigin und schenkte es ihr unter der gleichen bedingung diesmal aber nahm der koenig den schlaftrunk nicht weil ihm einer seiner diener verrathen was die koenigin das vorige mal gethan hatte wie nun das maedchen wieder in seinem zimmer weinte und wimmerte erwachte er und erkannte sie wieder und nun erkannte er auch dass was er im walde erlebt kein traum gewesen war erinnerte sich seines versprechens und nahm am andern tage das maedchen zu seiner frau und beide lebten gluecklich mit einander,0,0
mess_44,ein reicher mann der witwer geworden hatte eine einzige tochter die schoen und lieblich heranwuchs da wurde des vaters herz von unreiner liebe zu ihr entzuendet sie aber widerstand seinem begehren da drohte er ihr mit gewalt und nun sann sie auf list sie versprach ihm zu willen zu sein wenn er ihr ein kleid gebe das von silber stehen koenne als sie das bekommen verlangte sie eins das von golde steif sei und zum drittenmale eins das von gesteinen stehen koenne wie sie auch das erlangt sagte sie nun fehlt mir noch ein kraehenpelz und endlich hatte sie noch einen wunsch eine gluecksruthe auch die bekam sie,0,0
mess_44,479 nun wohnte in einem lande ein schoener prinz der hatte von der schoenheit des maedchens vernommen sie nahm die ruthe in die hand die kleider auf die schulter und wuenschte sich in die naehe von dem schloss des prinzen alsbald war sie in dem schlossgarten da wuenschte sie sich einen schrank in einer eiche des gartens that ihre kleider hinein zog den kraehenpelz an und ging in die schlosskueche wo sie sich fuer einen armen knaben ausgab der dienst suche dich kann ich gebrauchen sagte der koch du sollst aschenpuester werden nach ein paar tagen kam der prinz in die kueche und brachte ein erlegtes wild hin sie sah ihn und er gefiel ihr ueber die massen,0,0
mess_44,bald darauf war eine hochzeit auf einem schlosse in der naehe der prinz fuhr auch hin viele leute liefen um dem tanze zuzusehen aschenpuester bat den koch auch um die erlaubniss zusehen zu duerfen da lief sie zu der eiche zog das silberne kleid an und wuenschte sich einen wagen in dem sie nach dem schlosse fuhr der prinz sah sie und tanzte mit ihr aber nach ein paar taenzen war sie verschwunden setzte sich auf ihren wagen und sprach,0,0
mess_44,hinter mir dunkel und vorne mir klar,0,0
mess_44,dass niemand sehe wohin ich fahr,0,0
mess_44,am andern morgen war der prinz sehr uebler laune er hatte die ganze nacht gewacht und immer an seine schoene taenzerin gedacht aschenpuester musste ihm die stiefel putzen das that sie auch aber ein kleiner flecken an den zehen blieb ungeputzt das bemerkte der prinz kam zornig in die kueche hinein und warf ihr den stiefel an den kopf,0,0
mess_44,am naechsten abend wurde wieder getanzt und aschenpuester bat den koch wieder um erlaubniss diesmal zog sie das goldene kleid an und fuhr im wagen dahin der prinz hatte schon nach ihr ausgeschaut und wurde sehr vergnuegt als sie kam beim tanze fragte er sie wo sie zu hause sei in stiefelschmeiss antwortete sie sie blieb eine stunde da dann verschwand sie umsonst fragte der prinz wo stiefelschmeiss laege niemand konnte es ihm sagen,0,0
mess_44,der prinz that die nacht wieder kein auge zu und war noch verdriesslicher als am tage vorher aschenpuester musste ihm den rock buersten sie konnte es ihm aber nicht recht machen und zuletzt warf er ihr die buerste an den kopf,0,0
mess_44,480 am dritten abend als aschenpuester sich wieder erlaubniss zum zusehen erbeten hatte zog sie ihr kleid mit den edelsteinen an der prinz fragte sie beim tanze wo sie wohne in buerstenschmeiss gab sie zur antwort wer du auch seist sprach er nimm diesen ring von mir sie liess sich den ring an die hand stecken dann wollte sie entschluepfen aber der prinz passte ihr auf und fuhr dicht hinter ihr her sie stieg bei der eiche aus hatte aber nicht zeit das kleid abzulegen sondern zog nur in eile den kraehenpelz drueber,0,0
mess_44,als am andern morgen der koch die suppe bereitete liess aschenpuester den ring hineinfallen der prinz fand ihn und fragte wer in der kueche gewesen niemand als ich und aschenpuester erwiderte er er liess aschenpuester kommen mich juckts auf dem kopfe sprach er zu ihr sieh nach ob ungeziefer drauf ist aschenpuester gehorchte wie sie aber vor ihm stand da sah er unter dem abgenutzten kraehenpelz das demantkleid hervorschimmern da erkannte er sie nun bist du mein sprach er und er machte sie zu seiner frau und sie lebten gluecklich zusammen bis an ihr ende,0,0
mess_45,es war einmal ein armer handwerksmann der hatte zwei soehne einen guten der hiess hans und einen boesen der hiess helmerich wie das aber wohl geht in der welt der vater haette den boesen mehr lieb als den guten,0,0
mess_45,nun begab es sich dass das jahr einmal ein mehr als gewoehnlich teures war und dem meister der beutel leer ward ei dachte er man muss zu leben wissen sind die kunden 44 doch so oft zu dir gekommen nun ist es an dir hoeflich zu sein und dich zu ihnen zu bemuehen gesagt getan frueh morgens zog er aus und klopfte an mancher stattlichen tuer aber wie es sich denn so trifft dass die stattlichsten herren nicht die besten zahler sind die rechnung zu bezahlen hatte niemand lust so kam der handwerksmann muede und matt des abends in seine heimat und truebselig setzte er sich vor die tuere der schenke ganz allein denn er hatte weder das herz mit den zechgaesten zu plaudern noch freute er sich sehr auf das lange gesicht seines weibes aber wie er da sass in gedanken versunken konnte er doch nicht lassen hinzuhoeren auf das gespraech das drinnen gefuehrt ward ein fremder der eben aus der hauptstadt angelangt war erzaehlte dass die schoene koenigstochter von einem boesen zauberer gefangen gesetzt sei und muesse im kerker bleiben ihr lebelang wenn nicht jemand sich faende der die drei proben loeste welche der zauberer gesetzt hatte faende sich aber einer so waere die prinzess sein und ihr ganzes herrliches schloss mit all seinen schaetzen das hoerte der meister an zuerst mit halbem ohr dann mit dem ganzen und zuletzt mit allen beiden denn er dachte mein sohn helmerich ist ein aufgeweckter kopf der wohl den ziegenbock barbieren moechte so das einer von ihm heischte was gilts er loest die proben und wird der gemahl der schoenen prinzess und herr ueber land und leute denn also hatte der koenig ihr vater verkuendigen lassen  schleunig kehrte er nach haus und vergass seine schulden und kunden ueber der neuen maer die er eilig seiner frau hinterbrachte des andern 45 morgens schon sprach er zum helmerich dass er ihn mit ross und wehr ausruesten wolle zu der fahrt und wie schnell machte der sich auf die reise als er abschied nahm versprach er seinen eltern er wolle sie samt dem dummen bruder hans gleich holen lassen in einem sechsspaennigen wagen denn er meinte schon er waere koenig uebermuetig wie er dahinzog liess er seinen mutwillen aus an allem was ihm in den weg kam die voegel die auf den zweigen sassen und den herrgott lobten mit gesang wie sie es verstanden scheuchte er mit der gerte von den aesten und kein getier kam ihm in den weg daran er nicht seinen schabernack ausgelassen haetteund zum ersten begegnete er einem ameisenhaufen den liess er sein ross zertreten und die ameisen die erzuernt an sein ross und an ihn selbst krochen und pferd und mann bissen erschlug und erdrueckte er alle weiter kam er an einen klaren teich in dem schwammen zwoelf enten helmerich lockte sie ans ufer und toetete deren elf nur die zwoelfte entkam endlich traf er auch einen schoenen bienenstock da machte er es den bienen wie er es den ameisen gemacht und so war seine freude die unschuldige kreatur nicht sich zum nutzen sondern aus blosser tuecke zu plagen und zu zerstoeren,0,0
mess_45,als helmerich nun bei sinkender sonne das praechtige schloss erreicht hatte darin die prinzessin verzaubert war klopfte er gewaltig an die geschlossene pforte alles war still immer heftiger pochte der reiter endlich tat sich ein schiebefenster auf und hervor sah ein altes muetterlein mit spinnewebfarbigem gesichte die fragte verdriesslich was er begehre die prinzess will ich erloesen rief helmerich geschwind macht mir auf eile mit weile mein sohn sprach die alte morgen ist auch ein tag um neun uhr werde ich dich hier erwarten damit schloss sie den schalter,0,0
mess_45,am andern morgen um neun uhr als helmerich wieder 46 erschien stand das muetterchen schon seiner gewaertig mit einem faesschen voll leinsamen den sie ausstreute auf eine schoene wiese lies die koerner zusammen sprach sie zu dem reiter in einer stunde komme ich wieder da muss die arbeit getan sein  helmerich aber dachte das sei ein alberner spass und lohne es nicht sich darum zu buecken er ging derweil spazieren und als die alte wiederkam war das faesschen so leer wie vorher das ist nicht gut sagte sie darauf nahm sie zwoelf goldene schluesselchen aus der tasche und warf sie einzeln in den tiefen dunklen schlossteich hole die schluessel herauf sprach sie in einer stunde komme ich wieder da muss die arbeit getan sein helmerich lachte und tat wie vorher  als die alte wiederkam und auch diese aufgabe nicht geloest war da rief sie zweimal nicht gut nicht gut doch nahm sie ihn bei der hand und fuehrte ihn die treppe hinauf in den grossen saal des schlosses da sassen drei frauenbilder alle drei in dichte schleier verhuellt waehle mein sohn sprach die alte aber sieh dich vor dass du recht waehlst in einer stunde komme ich wieder helmerich war nicht klueger da sie wiederkam als da sie wegging uebermuetig aber rief er aufs geratewohle die zur rechten waehl ich  da warfen alle drei die schleier zurueck in der mitte sass die holdselige prinzess rechts und links zwei scheussliche drachen und der zur rechten packte den helmerich in seine krallen und warf ihn durch das fenster in den tiefen abgrund,0,0
mess_45,ein jahr war verflossen seit helmerich ausgezogen die prinzess zu erloesen und noch immer war bei den eltern kein sechsspaenniger wagen angelangt ach sprach der vater waere nur der ungeschickte hans ausgezogen statt unsres besten buben da waere das unglueck doch geringer  vater sagte hans lass mich hinziehn ich wills auch probieren aber der vater wollte nicht denn was dem klugen misslingt wie fuehrte das der ungeschickte zu ende da der vater ihm ross und wehr versagte machte hans sich heimlich auf und wanderte wohl drei tage denselben weg zu fuss den der bruder an einem geritten war aber er fuerchtete sich nicht und schlief des nachts auf dem weichen moos unter den gruenen zweigen so sanft wie unter dem dach seiner eltern die voegel des waldes scheuten sich nicht vor ihm sondern sangen ihn in schlaf mit ihren besten weisen als er nun an die ameisen kam die beschaeftigt 47 waren ihren neuen bau zu vollenden stoerte er sie nicht sondern wollte ihnen helfen und die tierchen die an ihm hinaufkrochen las er ab ohne sie zu toeten wenn sie ihn auch bissen die enten lockte er auch ans ufer aber um sie mit brosamen zu fuettern den bienen warf er die frischen blumen hin die er am wege gepflueckt hatte so kam er froehlich an das koenigsschloss und pochte bescheiden am schalter gleich tat die tuere sich auf und die alte fragte nach seinem begehr wenn ich nicht zu gering bin moechte ich es auch versuchen die schoene prinzess zu erloesen sagte er versuche es mein sohn sagte die alte aber wenn du die drei proben nicht bestehst kostet es dein leben wohlan muetterlein sprach hans sage was ich tun soll jetzt gab die alte ihm die probe mit dem leinsamen hans war nicht faul sich zu buecken doch schon schlug es drei viertel und das faesschen war noch nicht halb voll da wollte er schier verzagen aber auf einmal kamen schwarze ameisen mehr als genug und in wenigen minuten lag kein koernlein mehr auf der wiese als die alte kam sagte sie das ist gut und warf die zwoelf schluessel in den teich die sollte er in einer stunde herausholen aber hans brachte keinen schluessel aus der tiefe so tief er auch tauchte er kam nicht an den grund verzweifelnd setzte er sich ans ufer da kamen die zwoelf entchen herangeschwommen jede mit 48 einem goldenen schluesselchen im schnabel die warfen sie ins feuchte gras so war auch diese probe geloest als die alte wiederkam um ihn nun in den saal zu fuehren wo die dritte und schwerste probe seiner harrte verzagend sah hans auf die drei gleichen schleiergestalten wer sollte ihm hier helfen da kam ein bienenschwarm durchs offene fenster geflogen die kreisten durch den saal und summten um den mund der drei verhuellten aber von rechts und links flogen sie schnell wieder zurueck denn die drachen rochen nach pech und schwefel wovon sie leben die gestalt in der mitte umkreisten sie alle und surrten und schwirrten leise die mittle die mittle denn da duftete ihnen der geruch ihres eigenen honigs entgegen den die koenigstochter so gern ass also da die alte wiederkam nach einer stunde sprach hans ganz getrost ich waehle die mittle und da fuhren die boesen drachen zum fenster hinaus die schoene koenigstochter aber warf ihren schleier ab und freute sich der erloesung und ihres schoenen braeutigams und hans sandte dem vater der prinzess den schnellsten boten und zu seinen eltern einen goldenen wagen mit sechs pferden bespannt und sie alle lebten herrlich und in freuden und wenn sie nicht gestorben sind leben sie heute noch,0,0
mess_46,es war einmal in einem kleinen fischerdorf ein armer fischer der dort mit seiner frau lebte sie hatten keine kinder,0,0
mess_46,eines tages versuchte er fische zu fangen aber es biss einfach keiner an doch so gegen abend schliesslich als er schon seine siebensachen packen und fortgehen wollte ging ihm ein fisch an die angel er zog ihn hinaus und was sah er da ein ganz und gar goldenes fischlein da hoerte er wie der fisch zu ihm sprach,0,0
mess_46, lass mich noch einen tag wachsen dann kannst du mich fangen und essen,0,0
mess_46, na gut sagte sich der fischer da ich lass ihn wieder frei,0,0
mess_46,er nahm ihn also vom haken und warf ihn wieder ins meer,0,0
mess_46,als er am abend nach hause kam und seiner frau erzaehlte was er gesehen und gehoert hatte wurde sie boese weil sie nichts zu essen hatten,0,0
mess_46,am naechsten morgen ging der fischer wieder zum fischen und fing das goldene fischchen noch einmal da sagte es ihm,0,0
mess_46, jetzt gehoere ich dir du kannst mich essen aber bevor du mich isst werde ich dir einen ratschlag geben den du in deinem eigenen interesse befolgen solltest iss ein stueckchen und gib deiner frau auch eines zu essen dann wird sie zwillinge gebaeren danach nimm meine graeten und vergrab sie vor deinem haus dann werden zwei zypressen daraus spriessen dann nimm ein paar von ihren blaettern und fuettere alle tiere die du hast und sie werden auch zwillinge gebaeren,0,0
mess_46,und so geschah es nach einiger zeit bekamen sie zwei jungen zwillinge die beiden aehnelten einander so sehr dass man sie nicht voneinander unterscheiden konnte und auch die huendin und die katze bekamen zwillinge,0,0
mess_46,eines tages sahen sie noch etwas seltsames zusammen mit den wurzeln der zypressen die vor ihrem hause gewachsen waren sprossen auch zwei schwerter als die kinder groesser waren wollte eines von ihnen auswandern da nahm das kind eines der pferde einen der hunde und eines der schwerter bevor es loszog sagt es zu seiner mutter,0,0
mess_46, mutter ich habe ein zeichen in die ablage gemacht solange das zeichen dort ist geht es mir gut wenn es herunterfaellt dann schick meinen bruder um nach mir zu suchen denn dann befinde ich mich in gefahr,0,0
mess_46,er brach auf und zog sehr weit fort unterwegs traf er eine alte frau die ihn in ihrer huette aufnahm und bewirtete als sie ihm zu essen gab bat der junge um etwas wasser und da sagte ihm die alte frau,0,0
mess_46, ach mein kind wir haben hier kein wasser in dieser gegend hier lebt eine lamia die das wasser unter verschluss haelt wir bekommen nichts wenn sie nicht jeden tag ein maedchen zu fressen bekommt und morgen wird sie die koenigstochter rodanthi fressen,0,0
mess_46,als der junge mann das hoerte fragte er wo denn die lamia waere,0,0
mess_46, dort drueben sagte sie,0,0
mess_46,da brach er auf und ging an den ort an dem man die koenigstochter behuetete und wo die lamia sie fressen wuerde,0,0
mess_46, ich werde dich retten sagte er ihr du musst nicht weinen,0,0
mess_46,kurz darauf hoerte er ein droehnen und sah die lamia kommen,0,0
mess_46, oha sagte sie da heute werde ich gleich zwei zu fressen haben,0,0
mess_46,sobald sie sich ihnen naeherte nahm der junge mann das schwert das er hinter einigen steinen versteckt hatte warf die lamia zu boden und toetete sie daraufhin ging er und oeffnete die quellen seitdem hatten sie in der gegend wieder wasser,0,0
mess_46,dann kehrte er in die huette der alten frau zurueck sie kuesste ihn dankte ihm und schlug ihm vor mit ihr weiter zusammen zu wohnen die koenigstochter aber verliebte sich in ihn und wollte ihn zu ihrem mann haben er war einverstanden sie heirateten und lebten gluecklich miteinander,0,0
mess_46,dann kam der tag an dem der koenig seinem schwiegersohn das ganze koenigreich zeigen wollte sie reisten fort und kamen eines tages vor eine riesige burg,0,0
mess_46, geh niemals in diese burg hinein denn dort versteckt sich eine lamia die alle gefangen nimmt die hineinkommen sagte der koenig zu seinem schwiegersohn,0,0
mess_46,der junge mann aber beachtete den hinweis nicht weiter den ihm der koenig gegeben hatte und zog am naechsten tag los um alle leute zu befreien die die lamia gefangen hielt,0,0
mess_46,er schlug an die pforte und hoerte eine kraeftige stimme von innen,0,0
mess_46, wenn du waffen hast dann wirf sie nieder und komm rein,0,0
