quelle,episode,index_string,index_binar
mess_50,als nun der tag anbrach steckte der junge seine fuenfzig taler in die tasche ging hinaus auf die grosse landstrasse und sprach immer vor sich hin wenn mirs nur gruselte wenn 53 mirs nur gruselte da kam ein mann heran der hoerte das gespraech das der junge mit sich selber fuehrte und als sie ein stueck weiter waren dass man den galgen sehen konnte sagte der mann zu ihm siehst du dort ist der baum wo siebene mit des seilers tochter hochzeit gehalten haben und jetzt das fliegen lernen setz dich darunter und warte bis die nacht kommt so wirst du schon das gruseln lernen wenn weiter nichts dazu gehoert antwortete der junge das ist leicht getan lerne ich aber so geschwind das gruseln so sollst du meine fuenfzig taler haben komm nur morgen frueh wieder zu mir da ging der junge zu dem galgen setzte sich darunter und wartete bis der abend kam und weil ihn fror machte er sich ein feuer an aber um mitternacht ging der wind so kalt dass er trotz des feuers nicht warm werden wollte und als der wind die gehenkten gegeneinander stiess dass sie sich hinund herbewegten so dachte er du frierst unten bei dem feuer was moegen die da oben erst frieren und zappeln und weil er mitleidig war legte er die leiter an stieg hinauf knuepfte einen nach dem andern los und holte sie alle siebene herab darauf schuerte er das feuer blies es an und setzte sie ringsherum dass sie sich waermen sollten aber sie sassen da und regten sich nicht und das feuer ergriff ihre kleider da sprach er nehmt euch in acht sonst haeng ich euch wieder hinauf die toten aber hoerten nicht schwiegen und liessen ihre lumpen fortbrennen da ward er boes und sprach wenn ihr nicht achtgeben wollt so kann ich euch nicht helfen ich will nicht mit euch verbrennen und hing sie nach der reihe wieder hinauf nun setzte er sich zu seinem feuer und schlief ein und am andern morgen da kam der mann zu ihm wollte die fuenfzig taler haben und sprach nun weisst du was gruseln ist nein antwortete er woher sollte ichs wissen die da droben haben das maul nicht aufgetan und waren so dumm dass sie die paar alten lappen die sie am leibe haben brennen liessen da sah der mann dass er die fuenfzig taler heute nicht davontragen wuerde ging fort und sprach so einer ist mir noch nicht vorgekommen,0,0
mess_50,der junge ging auch seines wegs und fing wieder an vor sich hin zu reden ach wenn mirs nur gruselte ach wenn mirs nur 54 gruselte das hoerte ein fuhrmann der hinter ihm herschritt und fragte wer bist du ich weiss nicht antwortete der junge der fuhrmann fragte weiter wo bist du her ich weiss nicht wer ist dein vater das darf ich nicht sagen was brummst du bestaendig in den bart hinein ei antwortete der junge ich wollte dass mirs gruselte aber niemand kann michs lehren lass dein dummes geschwaetz sprach der fuhrmann komm geh mit mir ich will sehen dass ich dich unterbringe der junge ging mit dem fuhrmann und abends gelangten sie zu einem wirtshaus wo sie uebernachten wollten da sprach er beim eintritt in die stube wieder ganz laut wenn mirs nur gruselte wenn mirs nur gruselte der wirt der das hoerte lachte und sprach wenn dich danach luestet dazu sollte hier wohl gelegenheit sein ach schweig stille sprach die wirtsfrau so mancher vorwitzige hat schon sein leben eingebuesst es waere jammer und schade um die schoenen augen wenn die das tageslicht nicht wieder sehen sollten der junge aber sagte wenns noch so schwer waere ich wills einmal lernen deshalb bin ich ja ausgezogen er liess dem wirt auch keine ruhe 55 bis dieser erzaehlte nicht weit davon staende ein verwuenschtes schloss wo einer wohl lernen koennte was gruseln waere wenn er nur drei naechte darin wachen wollte der koenig haette dem ders wagen sollte seine tochter zur frau versprochen und die waere die schoenste jungfrau welche die sonne beschien in dem schlosse steckten auch grosse schaetze von boesen geistern bewacht die wuerden dann frei und koennten einen armen reich genug ma chen schon viele waeren wohl hinein aber noch keiner wieder herausgekommen da ging der junge am andern morgen vor den koenig und sprach wenns erlaubt waere so wollte ich wohl drei naechte in dem verwuenschten schlosse wachen der koenig sah ihn an und weil er ihm gefiel sprach er du darfst dir noch dreierlei ausbitten aber es muessen leblose dinge sein und das darfst du mit ins schloss nehmen da antwortete er so bitt ich um ein feuer eine drehbank und eine schnitzbank mit dem messer,0,0
mess_50,der koenig liess ihm das alles bei tage in das schloss tragen als es nacht werden wollte ging der junge hinauf machte sich in einer kammer ein helles feuer an stellte die schnitzbank mit dem messer daneben und setzte sich auf die drehbank ach wenn mirs nur gruselte sprach er aber hier werde ichs auch nicht lernen gegen mitternacht wollte er sich sein feuer einmal aufschueren wie er so hineinblies da schries ploetzlich aus einer ecke au miau was uns friert ihr narren rief er was schreit ihr wenn euch friert kommt setzt euch ans feuer und waermt euch und wie er das gesagt hatte kamen zwei grosse schwarze katzen in einem gewaltigen sprunge herbei setzten sich ihm zu beiden seiten und sahen ihn mit ihren feurigen augen ganz wild an ueber ein weilchen als sie sich gewaermt hatten sprachen sie kamerad wollen wir eins in der karte spielen warum nicht antwortete er aber zeigt einmal eure pfoten her da streckten sie die krallen aus ei sagte er was habt ihr lange naegel wartet die muss ich euch erst abschneiden damit packte er sie beim kragen hob sie auf die schnitzbank und schraubte ihnen die pfoten fest euch habe ich auf die finger gesehen sprach er da vergeht mir die lust zum kartenspiel schlug sie tot und warf sie hinaus ins wasser als er aber die zwei zur ruhe gebracht hatte und sich 56 wieder zu seinem feuer setzen wollte da kamen aus allen ecken und enden schwarze katzen und schwarze hunde an gluehenden ketten immer mehr und mehr dass er sich nicht mehr bergen konnte die schrieen greulich traten ihm auf sein feuer zerrten es auseinander und wollten es ausmachen das sah er ein weilchen ruhig mit an als es ihm aber zu arg ward fasste er sein schnitzmesser und rief fort mit dir du gesindel und haute auf sie los ein teil sprang weg die andern schlug er tot und warf sie hinaus in den teich als er wiedergekommen war blies er aus den funken sein feuer frisch an und waermte sich und als er so sass wollten ihm die augen nicht laenger offen bleiben und er bekam lust zu schlafen da blickte er um sich und sah in der ecke ein grosses bett das ist mir eben recht sprach er und legte sich hinein als er aber die augen zutun wollte so fing das bett von selbst an zu fahren und fuhr im ganzen schloss herum recht so sprach er nur besser zu da rollte das bett fort als waeren sechs pferde vorgespannt ueber schwellen und treppen auf und ab auf einmal hopp hopp warf es um das unterste zu oberst dass es wie ein 57 berg auf ihm lag aber er schleuderte decken und kissen in die hoehe stieg heraus und sagte nun mag fahren wer lust hat legte sich an sein feuer und schlief bis es tag war am morgen kam der koenig und als er ihn da auf der erde liegen sah meinte er die gespenster haetten ihn umgebracht und er waere tot da sprach er es ist doch schade um den schoenen menschen das hoerte der junge richtete sich auf und sprach so weit ists noch nicht da verwunderte sich der koenig freute sich aber und fragte wie es ihm gegangen waere recht gut antwortete er eine nacht waere herum die zwei andern werden auch herumgehen als er zum wirt kam da machte der grosse augen ich dachte nicht sprach er dass ich dich wieder lebendig sehen wuerde hast du nun gelernt was gruseln ist nein sagte er es ist alles vergeblich wenn mirs nur einer sagen koennte,0,0
mess_50,die zweite nacht ging er abermals hinauf ins alte schloss setzte sich zum feuer und fing sein altes lied wieder an wenn mirs nur gruselte wie mitternacht herankam liess sich ein laerm und gepolter hoeren erst sachte dann immer staerker dann wars ein bisschen still endlich kam mit lautem geschrei ein halber mensch den schornstein herab und fiel vor ihm hin heda rief er noch ein halber gehoert dazu das ist zu wenig da ging der laerm von frischem an es tobte und heulte und fiel die andere haelfte auch herab wart sprach er ich will dir erst das feuer ein wenig anblasen wie er das getan hatte und sich wieder umsah da waren die beiden stuecke zusammengefahren und sass da ein greulicher mann auf seinem platz so haben wir nicht gewettet sprach der junge die bank ist mein der mann wollte ihn wegdraengen aber der junge liess sichs nicht gefallen schob ihn mit gewalt weg und setzte sich wieder auf seinen platz da fielen noch mehr maenner herab einer nach dem andern die holten neun totenbeine und zwei totenkoepfe setzten auf und spielten kegel der junge bekam auch lust und fragte hoert ihr kann ich mit sein ja wenn du geld hast geld genug antwortete er aber eure kugeln sind nicht recht rund da nahm er die totenkoepfe setzte sie in die drehbank und drehte sie rund so jetzt werden sie besser schueppeln sprach er heida nun gehts lustig er spielte mit 58 und verlor etwas von seinem geld als es aber zwoelf schlug war alles vor seinen augen verschwunden er legte sich nieder und schlief ruhig ein am andern morgen kam der koenig und wollte sich erkundigen wie ist dirs diesmal ergangen fragte er ich habe gekegelt antwortete er und ein paar heller verloren hat dir denn nicht gegruselt ei was sprach er lustig hab ich mich gemacht wenn ich nur wuesste was gruseln waere,0,0
mess_50,in der dritten nacht setzte er sich wieder auf seine bank und sprach ganz verdriesslich wenn es mir nur gruselte als es spaet ward kamen sechs grosse maenner und brachten eine totenlade hereingetragen da sprach er ha ha das ist gewiss mein vetterchen das erst vor ein paar tagen gestorben ist winkte mit dem finger und rief komm vetterchen komm sie stellten den sarg auf die erde er aber ging hinzu und nahm den deckel ab da lag ein toter mann darin er fuehlte ihm ans gesicht aber es war kalt wie eis wart sprach er ich will dich ein bisschen waermen ging ans feuer waermte seine hand und legte sie ihm aufs gesicht aber der tote blieb 59 kalt nun nahm er ihn heraus setzte sich ans feuer und legte ihn auf seinen schoss und rieb ihm die arme damit das blut wieder in bewegung kommen sollte als auch das nichts helfen wollte fiel ihm ein wenn zwei zusammen im bett liegen so waermen sie sich brachte ihn ins bett deckte ihn zu und legte sich neben ihn ueber ein weilchen ward auch der tote warm und fing an sich zu regen da sprach der junge siehst du vetterchen haett ich dich nicht gewaermt der tote aber hub an und rief jetzt will ich dich er wuergen was sagte er ist das mein dank gleich sollst du wieder in deinen sarg hub ihn auf warf ihn hinein und machte den deckel zu da kamen die sechs maenner und trugen ihn wieder fort es will mir nicht gruseln sagte er hier lerne ichs mein lebtag nicht,0,0
mess_50,da trat ein mann herein der war groesser als alle andere und sah fuerchterlich aus er war aber alt und hatte einen langen weissen bart o du wicht rief er nun sollst du bald lernen was gruseln ist denn du sollst sterben nicht so schnell antwortete der junge soll ich sterben so muss ich auch dabei sein dich will ich schon packen sprach der unhold60 sachte sachte mach dich nicht so breit so stark wie du bin ich auch und wohl noch staerker das wollen wir sehn sprach der alte bist du staerker als ich so will ich dich gehn lassen komm wir wollens versuchen da fuehrte er ihn durch dunkle gaenge zu einem schmiedefeuer nahm eine axt und schlug den einen amboss mit einem schlag in die erde das kann ich noch besser sprach der junge und ging zu dem andern amboss der alte stellte sich neben hin und wollte zusehen und sein weisser bart hing herab da fasste der junge die axt spaltete den amboss auf einen hieb und klemmte den bart des alten mit hinein nun hab ich dich sprach der junge jetzt ist das sterben an dir dann fasste er eine eisenstange und schlug auf den alten los bis er wimmerte und bat er moechte aufhoeren er wollte ihm grosse reichtuemer geben der junge zog die axt raus und liess ihn los der alte fuehrte ihn wieder ins schloss zurueck und zeigte ihm in einem keller drei kasten voll gold davon sprach er ist ein teil den armen der andere dem koenig der dritte dein indem schlug es zwoelfe und der geist verschwand also dass der junge im finstern stand ich werde mir doch heraushelfen koennen sprach er tappte herum fand den weg in die kammer und schlief dort bei seinem feuer ein am andern morgen kam der koenig und sagte nun wirst du gelernt haben was gruseln ist nein antwortete er was ists nur mein toter vetter war da und ein baertiger mann ist gekommen der hat mir da unten viel geld gezeigt aber was gruseln ist hat mir keiner gesagt da sprach der koenig du hast das schloss erloest und sollst meine tochter heiraten das ist all recht gut antwortete er aber ich weiss noch immer nicht was gruseln ist,0,0
mess_50,da ward das gold heraufgebracht und die hochzeit gefeiert aber der junge koenig so lieb er seine gemahlin hatte und so vergnuegt er war sagte doch immer wenn mir nur gruselte wenn mir nur gruselte das verdross sie endlich ihr kammermaedchen sprach ich will hilfe schaffen das gruseln soll er schon lernen sie ging hinaus zum bach der durch den garten floss und liess sich einen ganzen eimer voll gruendlinge holen nachts als der junge koenig schlief musste seine gemahlin ihm die decke wegziehen und den eimer voll kalt wasser mit den 61 gruendlingen ueber ihn herschuetten dass die kleinen fische um ihn herumzappelten da wachte er auf und rief ach was gruselt mir was gruselt mir liebe frau ja nun weiss ich was gruseln ist,0,0
mess_51,es war einmal ein koenig und eine koenigin die lebten in frieden miteinander und hatten zwoelf kinder das waren aber lauter buben nun sprach der koenig zu seiner frau wenn das dreizehnte kind was du zur welt bringst ein maedchen ist so sollen die zwoelf buben sterben damit sein reichtum gross wird und das koenigreich ihm allein zufaellt er liess auch zwoelf saerge machen die waren schon mit hobelspaenen gefuellt und in jedem lag das totenkisschen und liess sie in eine verschlossene stube bringen dann gab er der koenigin den schluessel und gebot ihr niemand etwas davon zu sagen,0,0
mess_51,die mutter aber sass nun den ganzen tag und trauerte so dass der kleinste sohn der immer bei ihr war und den sie nach der bibel benjamin nannte zu ihr sprach liebe mutter warum bist du so traurig liebstes kind antwortete sie ich darf dirs nicht sagen er liess ihr aber keine ruhe bis sie ging und die stube aufschloss und ihm die zwoelf mit hobelspaenen schon gefuellten totenladen zeigte darauf sprach sie mein liebster benjamin diese saerge hat dein vater fuer dich und deine elf brueder machen lassen denn wenn ich ein maedchen zur welt bringe so sollt ihr allesamt getoetet und darin begraben werden und als sie weinte waehrend sie das sprach so troestete sie der sohn und sagte weine nicht liebe mutter wir wollen uns schon helfen und wollen fortgehen sie aber sprach geh mit deinen elf bruedern hinaus in den wald und einer setze sich immer auf den hoechsten baum der zu finden ist und halte wacht und schaue nach dem turm hier im schloss gebaer ich ein soehnlein so will ich eine weisse fahne aufstecken und dann duerft ihr wiederkommen gebaer ich ein toechterlein so will ich eine rote fahne aufstecken und dann flieht fort so schnell ihr koennt und der liebe gott behuete euch alle nacht will ich aufstehen und fuer euch beten im winter dass ihr an einem feuer euch waermen koennt im sommer dass ihr nicht in der hitze schmachtet,0,0
mess_51,nachdem sie also ihre soehne gesegnet hatte gingen sie hinaus 80 in den wald einer hielt um den andern wache sass auf der hoechsten eiche und schaute nach dem turm als elf tage herum waren und die reihe an benjamin kam da sah er wie eine fahne aufgesteckt wurde es war aber nicht die weisse sondern die rote blutfahne die verkuendete dass sie alle sterben sollten wie die brueder das hoerten wurden sie zornig und sprachen sollten wir um eines maedchens willen den tod leiden wir schwoeren dass wir uns raechen wollen wo wir ein maedchen finden soll sein rotes blut fliessen,0,0
mess_51,darauf gingen sie tiefer in den wald hinein und mitten drein wo er am dunkelsten war fanden sie ein kleines verwuenschtes haeuschen das leer stand da sprachen sie hier wollen wir wohnen und du benjamin du bist der juengste und schwaechste du sollst daheim bleiben und haushalten wir andern wollen ausgehen und essen holen nun zogen sie in den wald und schossen hasen wilde rehe voegel und taeuberchen und was zu essen stand das brachten sie dem benjamin der musste es ihnen zurecht machen damit sie ihren hunger stillen konnten in dem haeuschen lebten sie zehn jahre zusammen und die zeit ward ihnen nicht lang,0,0
mess_51,das toechterchen das ihre mutter die koenigin geboren hatte war nun herangewachsen war gut von herzen und schoen von angesicht und hatte einen goldenen stern auf der stirne einmal als grosse waesche war sah es darunter zwoelf mannshemden und fragte seine mutter wem gehoeren diese zwoelf hemden fuer den vater sind sie doch viel zu klein da antwortete sie mit schwerem herzen liebes kind die gehoeren deinen zwoelf bruedern sprach das maedchen wo sind meine zwoelf brueder ich habe noch niemals von ihnen gehoert sie antwortete das weiss gott wo sie sind sie irren in der welt herum da nahm sie das maedchen und schloss ihm das zimmer auf und zeigte ihm die zwoelf saerge mit den hobelspaenen und den totenkisschen diese saerge sprach sie waren fuer deine brueder bestimmt aber sie sind heimlich fortgegangen eh du geboren warst und erzaehlte ihm wie sich alles zugetragen hatte da sagte das maedchen liebe mutter weine nicht ich will gehen und meine brueder suchen,0,0
mess_51,nun nahm es die zwoelf hemden und ging fort und geradezu 81 in den grossen wald hinein es ging den ganzen tag und am abend kam es zu dem verwuenschten haeuschen da trat es hinein und fand einen jungen knaben der fragte wo kommst du her und wo willst du hin und erstaunte dass sie so schoen war koenigliche kleider trug und einen stern auf der stirne hatte da antwortete sie ich bin eine koenigstochter und suche meine zwoelf brueder und will gehen so weit der himmel blau ist bis ich sie finde sie zeigte ihm auch die zwoelf hemden die ihnen gehoerten da sah benjamin dass es seine schwester war und sprach ich bin benjamin dein juengster bruder und sie fing an zu weinen vor freude und benjamin auch und sie kuessten und herzten einander vor grosser liebe hernach sprach er liebe schwester es ist noch ein vorbehalt da wir hatten verabredet dass ein jedes maedchen das uns begegnete sterben sollte weil wir um ein maedchen unser koenigreich verlassen mussten da sagte sie ich will gerne sterben wenn ich damit meine zwoelf brueder erloesen kann nein antwortete er du sollst nicht sterben setze dich unter diese buette bis die elf brueder kommen dann will ich schon einig mit ihnen werden also tat sie und wie es nacht ward kamen die andern von der jagd und die mahlzeit war bereit und als sie am tische sassen und assen fragten sie was gibts neues sprach benjamin wisst ihr nichts nein antworteten sie sprach er weiter ihr seid im walde gewesen und ich bin daheim geblieben und weiss doch mehr als ihr so erzaehle uns riefen sie antwortete er versprecht ihr mir auch dass das erste maedchen das uns begegnet nicht soll getoetet werden ja riefen alle das soll gnade haben erzaehl uns nur da sprach er unsere schwester ist da und hub die buette auf und die koenigstochter kam hervor in ihren koemglichen kleidern mit dem goldenen stern auf der stirne und war so schoen zart und fein da freueten sie sich alle fielen ihr um den hals und kuessten sie und hatten sie vom herzen lieb,0,0
mess_51,nun blieb sie bei benjamin zu haus und half ihm in der arbeit die elfe zogen in den wald fingen gewild rehe voegel und taeuberchen damit sie zu essen hatten und die schwester und benjamin sorgten dass es zubereitet wurde sie suchte das holz zum kochen und die kraeuter zum gemues und stellte 82 die toepfe ans feuer also dass die mahlzeit immer fertig war wenn die elfe kamen sie hielt auch sonst ordnung im haeuschen und deckte die bettlein huebsch weiss und rein und die brueder waren immer zufrieden und lebten in grosser einigkeit mit ihr,0,0
mess_51,auf eine zeit hatten die beiden daheim eine schoene kost zurechtgemacht und wie sie nun alle beisammen waren setzten sie sich assen und tranken und waren voller freude es war aber ein kleines gaertchen an dem verwuenschten haeuschen darin standen zwoelf lilienblumen die man auch studenten heisst nun wollte sie ihren bruedern ein vergnuegen machen brach die zwoelf blumen ab und dachte jedem aufs essen eine zu schenken wie sie aber die blumen abgebrochen hatte in demselben augenblick waren die zwoelf brueder in zwoelf raben verwandelt und flogen ueber den wald hin fort und das haus mit dem garten war auch verschwunden da war nun das arme maedchen allein in dem wilden wald und wie es sich umsah so stand eine alte frau neben ihm die sprach mein kind was hast du angefangen warum hast du die zwoelf weissen blumen nicht stehen lassen das waren deine brueder die sind nun auf immer in raben verwandelt das maedchen sprach weinend ist denn kein mittel sie zu erloesen nein sagte die alte es ist keins auf der ganzen welt als eins das ist aber so schwer dass du sie damit nicht befreien wirst denn du musst sieben jahre stumm sein darfst nicht sprechen und nicht lachen und sprichst du ein einziges wort und es fehlt nur eine stunde an den sieben jahren so ist alles umsonst und deine brueder werden von dem einen wort getoetet,0,0
mess_51,da sprach das maedchen in seinem herzen ich weiss gewiss dass ich meine brueder erloese und ging und suchte einen hohen baum setzte sich darauf und spann und sprach nicht und lachte nicht nun trugs sich zu dass ein koenig in dem walde jagte der hatte einen grossen windhund der lief zu dem baum wo das maedchen darauf sass sprang herum schrie und bellte hinauf da kam der koenig herbei und sah die schoene koenigstochter mit dem goldenen stern auf der stirne und war so entzueckt ueber ihre schoenheit dass er ihr zurief ob sie seine gemahlin 83 werden wollte sie gab keine antwort nickte aber ein wenig mit dem kopf da stieg er selbst auf den baum trug sie herab setzte sie auf sein pferd und fuehrte sie heim da ward die hochzeit mit grosser pracht und freude gefeiert aber die braut sprach nicht und lachte nicht als sie ein paar jahre miteinander vergnuegt gelebt hatten fing die mutter des koenigs die eine boese frau war an die junge koenigin zu verleumden und sprach zum koenig es ist ein gemeines bettelmaedchen das du dir mitgebracht hast wer weiss was fuer gottlose streiche sie heimlich treibt wenn sie stumm ist und nicht sprechen kann so koennte sie doch einmal lachen aber wer nicht lacht der hat ein boeses gewissen der koenig wollte zuerst nicht daran glauben aber die alte trieb es so lange und beschuldigte sie so viel boeser dinge dass der koenig sich endlich ueberreden liess und sie zum tod verurteilte,0,0
mess_51,nun ward im hof ein grosses feuer angezuendet darin sollte sie verbrannt werden und der koenig stand oben am fenster und sah mit weinenden augen zu weil er sie noch immer so lieb hatte und als sie schon an den pfahl festgebunden war und das feuer an ihren kleidern mit roten zungen leckte da war eben der letzte augenblick von den sieben jahren verflossen da liess sich in der luft ein geschwirr hoeren und zwoelf raben kamen hergezogen und senkten sich nieder und wie sie die erde beruehrten waren es ihre zwoelf brueder die sie erloest hatte sie rissen das feuer auseinander loeschten die flammen machten ihre liebe schwester frei und kuessten und herzten sie nun aber da sie ihren mund auftun und reden durfte erzaehlte sie dem koenige warum sie stumm gewesen waere und niemals gelacht haette der koenig freute sich als er hoerte dass sie unschuldig war und sie lebten nun alle zusammen in einigkeit bis an ihren tod die boese stiefmutter ward vor gericht gestellt und in ein fass gesteckt das mit siedendem oel und giftigen schlangen angefuellt war und starb eines boesen todes,0,0
mess_52,es war einmal ein tischler und ein goldschmied die sprachen wer wol das beste kunststueck von ihnen machen koenne da kommt der meister goldschmied an und bringt einen goldenen fisch der schwimmt immer im wasser umher da kommt der tischler auch und fliegt zum fenster herein und hat sich ein paar fluegel gemacht mit denen er fliegt fliegt noch ein mal zum fenster hinaus und drei mal ums haus herum da macht ein prinz die fluegel an der will nachher wieder niederfliegen fliegt aber immer hoeher und hoeher und kann nicht nieder da fliegt er auf eine kirche die hoch in der luft gewesen ist in der kirche wohnt eine prinzessin die macht das fenster auf da fliegt er hinein heirathet die prinzessin und wohnt mit ihr in der kirche 16 da bekamen sie einen kleinen knaben den liessen sie in einer schachtel auf die erde nieder,0,0
mess_52,da fand eine alte boese frau den knaben in der schachtel und nahm ihn zu sich wollte ihn aber als er etwas herangewachsen war vergiften um seiner los zu werden der junge ging in den wald da kam ein zwerg und uebergab ihm drei hunde die hiessen stahl eisen und hille 1 er empfahl ihm auch alles zu thun was die hunde wollten und sie ja nicht zu schlagen,0,0
mess_52,als der waisenknabe nach haus kam hatten ihm seine pflegeaeltern vergiftetes essen hingestellt um ihn damit zu toedten wie er aber den ersten loeffel voll zum munde fuehrte sprang der hund stahl auf und schlug mit der pfote unter den loeffel sodass die speise die darin war verschuettet wurde dasselbe that der hund eisen als er den zweiten loeffel zum munde fuehrte als er den dritten loeffel fuellen wollte stiess der hund hille den ganzen napf um und der waisenknabe musste sich hungrig zu bett legen,0,0
